{"acl":{"forbidden_write_count":0,"inheritance_protected":true,"policy_fingerprint_match":true,"required_principal_classes":["configured_owner","SYSTEM","Administrators"]},"authority_digest":"sha256:sedb-ral-json-nfc-codepoint-v1:89d7b660f6c8e31e7aec188d77fe75ab87b684007bf06093b123e10a9c69d8b8","authority_scopes":["registry.root.initialize","registry.root.inspect_acl","registry.root.checkpoint","registry.root.rehearse_restore","registry.root.rehearse_rollback"],"canonical_tree_digest":"sha256:sedb-ral-json-nfc-codepoint-v1:0351c96e1ad5ca1cf32340df882a4edf96209c3a31ae628f602e04ad22939c4f","checkpoint_digest":"sha256:sedb-ral-json-nfc-codepoint-v1:a7d7d061f645ebcf92662506d5a5addb93762955487b3b2973fd5fd9471bd930","checkpoint_snapshot_digest":"sha256:sedb-ral-json-nfc-codepoint-v1:3c495932620828af6f39fd5a3e22f52f2d9a5f88c8a7201592b5bcae7a0bc852","ci":{"head_commit":"a7d2bf680b796416eb1b4c043c3dec688a417d03","job_count":6,"run_id":32841941812,"status":"success","successful_jobs":6,"workflow":"phase3a.yml"},"control_digest":"sha256:sedb-ral-json-nfc-codepoint-v1:8f3c7a9443646c188b90e4bb28c921f8401b1c7f51bd1a90c1e8004dbb783b38","counts":{"addresses":0,"applications":0,"ledger_events":0,"residents":0},"effects":{"external":0,"network":0,"private_reads":0},"evidence_refs":["evidence/production-registry-root/2026-08-25-local-synthetic.json","docs/runtime/PRODUCTION_REGISTRY_ROOT.md"],"manifest_digest":"sha256:sedb-ral-json-nfc-codepoint-v1:ebc9cc8facd63a157b77a744268651d1e6fe803c98b9c3f817e04080479d7b4f","not_claimed":["resident_admission","private_access","offsite_backup","volume_loss_recovery","ctcl_registered_time","cleanup"],"phase":"P3-4","plan_digest":"sha256:sedb-ral-json-nfc-codepoint-v1:c3073fa454932d73971ae25e05e170724f104f1825a5fc8e46b0a0ab9fa9126e","production_root_ref":"AI_RESIDENCE/REGISTRY/SEDB-RAL","receipt_digest":"sha256:sedb-ral-json-nfc-codepoint-v1:35cb75012dc883b310ff18bc99c2791d054a1cf09938549b20f0a8726b1b6486","recovery":{"fresh_restore_byte_identical":true,"production_digest_unchanged":true,"restore_byte_identical":true,"rollback_red_control":"checkpoint_manifest_digest_mismatch","storage_scope":"same_volume_local"},"registry_id":"registry:dabee562-6af0-496d-94e8-1be9539b32ac","restore_receipt_digest":"sha256:sedb-ral-json-nfc-codepoint-v1:dea1bb7bcc9abd1426baa2bc59e8e8e2d963841f99a12f1a4c4fba9fa91ca44a","restored_byte_map_digest":"sha256:sedb-ral-json-nfc-codepoint-v1:71a9f6434365273a2f0aca274ba3f775ce05bd921f1cd89890c1b77a3bdb0a81","rollback_receipt_digest":"sha256:sedb-ral-json-nfc-codepoint-v1:6071a492b318df5adafd2d3b11b3b7e9e69b233a0041dee3a861d5735f5f5864","schema":"sedb-ral.production-registry-acceptance/0.1","source_commit":"a7d2bf680b796416eb1b4c043c3dec688a417d03","source_package_version":"0.4.0","status":"passed","time_status":"host_wall_clock_unverified","wrapper_history":{"cleanup_performed":false,"initializer_status":"stopped_after_candidate_prepare","publication_resume":"same_plan_core_no_replace","rollback_cli_status":"stopped_before_core_target_creation","rollback_resume":"same_authority_direct_core"}}
